{
  "schema": "raven.reuse/v1",
  "identity": {
    "project": "sum-three-example",
    "code_sha256": "133b23137e9fb81e566540a0239c4606b5b2a9bcc09d3cdf06dfce37bee82c25",
    "environment_sha256": "a84ecb1bfca05ed6262169a1d1ee7a743bc1520d25227c87a6b6b86634e67d78",
    "parameters_sha256": "1f3aa772dd5ecd94d5ec8f979d61ac1f786998469f80e09a746f8169d9da5f7a",
    "inputs_sha256": {
      "input.txt": "14c5e74c4b96ccef41cd94db73a9ec3348038ac094feca4fd897cecffa07cdae",
      "requirements.lock": "6138c7ed534772d9b246f5c8417e3484bcfddc24e2980cf38efdb71a2e682941"
    }
  },
  "dependencies": [
    {
      "path": "solver.py",
      "sha256": "133b23137e9fb81e566540a0239c4606b5b2a9bcc09d3cdf06dfce37bee82c25",
      "role": "code"
    },
    {
      "path": "environment.json",
      "sha256": "a84ecb1bfca05ed6262169a1d1ee7a743bc1520d25227c87a6b6b86634e67d78",
      "role": "environment"
    },
    {
      "path": "parameters.json",
      "sha256": "1f3aa772dd5ecd94d5ec8f979d61ac1f786998469f80e09a746f8169d9da5f7a",
      "role": "parameters"
    },
    {
      "path": "input.txt",
      "sha256": "14c5e74c4b96ccef41cd94db73a9ec3348038ac094feca4fd897cecffa07cdae",
      "role": "input"
    },
    {
      "path": "requirements.lock",
      "sha256": "6138c7ed534772d9b246f5c8417e3484bcfddc24e2980cf38efdb71a2e682941",
      "role": "input"
    }
  ],
  "outputs": [
    {
      "path": "answer.txt",
      "sha256": "06e9d52c1720fca412803e3b07c4b228ff113e303f4c7ab94665319d832bbfb7",
      "target": "results/answer.txt"
    }
  ],
  "acceptance": {
    "path": "acceptance.json",
    "sha256": "bb11858f1317e235798bc4e892accdd6f27794f901ec9bea62332f30aa90426d"
  },
  "results": {
    "path": "results.json",
    "sha256": "7e74b45318e6a103a08262259a7a11093d3d1dfa039d655135391bc6a4a294cc"
  }
}
